{
  "schemaVersion": "agent-lcars.trajectory-corpus/v1",
  "corpusId": "issue-523-production-20-run",
  "frozenAt": "2026-08-04T15:31:10Z",
  "sourceWindow": {
    "from": "2026-08-01T17:41:47Z",
    "to": "2026-08-04T15:31:10Z",
    "selection": "The 20 most recent completed, non-skipped Claude, Codex, or OpenCode worker executions at the #523 audit cutoff, ordered by workflow creation time.",
    "sourceRefs": [
      {
        "kind": "issue",
        "url": "https://github.com/jlapenna/agent-lcars/issues/523",
        "sha256": null,
        "access": "public"
      }
    ]
  },
  "privacy": {
    "contentPolicy": "public-metadata",
    "redactionPolicy": "agent-lcars.trajectory-redaction/v1",
    "transcriptPolicy": "protected-reference-only"
  },
  "entries": [
    {
      "id": "run-30869989822",
      "repository": "jlapenna/agent-lcars",
      "repositoryVisibility": "public",
      "anchor": {
        "number": 447,
        "type": "issue",
        "snapshot": {
          "availability": "reference-only",
          "capturedAt": null,
          "sourceRef": {
            "kind": "issue",
            "url": "https://github.com/jlapenna/agent-lcars/issues/447",
            "sha256": null,
            "access": "public"
          }
        }
      },
      "taskClass": "console-ui-ambiguity",
      "dispatch": {
        "mode": "implement",
        "generation": 1,
        "workflowSha": "4fc73d489d1e7a04a19bcb976665f8bbc9b682a0",
        "workflowPath": ".github/workflows/codex.yml",
        "runId": 30869989822,
        "runUrl": "https://github.com/jlapenna/agent-lcars/actions/runs/30869989822",
        "workflowConclusion": "success",
        "agent": "codex",
        "provider": "openai",
        "model": null,
        "budgetMinutes": 60,
        "brief": {
          "availability": "reference-only",
          "capturedAt": null,
          "sourceRef": {
            "kind": "dispatch-brief",
            "url": "https://github.com/jlapenna/agent-lcars/actions/runs/30869989822",
            "sha256": null,
            "access": "public"
          }
        }
      },
      "setup": {
        "outcome": "ready",
        "agentProcessStarted": true,
        "modelTurnObserved": true
      },
      "milestones": {
        "queuedAt": "2026-08-04T01:50:50Z",
        "agentStartedAt": "2026-08-04T01:53:07Z",
        "takeoverAt": null,
        "diagnosisAt": null,
        "firstDurableArtifactAt": "2026-08-04T01:58:57Z",
        "terminalAt": "2026-08-04T02:01:31Z"
      },
      "trajectory": {
        "outcome": "productive",
        "archiveRefs": []
      },
      "terminal": {
        "kind": "merged-deliverable",
        "artifactRefs": [
          {
            "kind": "pull-request",
            "url": "https://github.com/jlapenna/agent-lcars/pull/453",
            "sha256": null,
            "access": "public"
          }
        ]
      },
      "quality": {
        "accepted": true,
        "ci": "green",
        "review": "no-objection",
        "merged": true,
        "regression": "none-known"
      },
      "efficiency": {
        "queueSeconds": 109,
        "modelSeconds": 490,
        "firstArtifactSeconds": 350,
        "runnerMinutes": 8.85,
        "retries": 0
      },
      "annotations": {
        "automatic": {
          "confidence": "high",
          "sourceRefs": [
            {
              "kind": "workflow-run",
              "url": "https://github.com/jlapenna/agent-lcars/actions/runs/30869989822",
              "sha256": null,
              "access": "public"
            }
          ]
        },
        "human": {
          "reviewer": "jlapenna",
          "reviewedAt": "2026-08-04T15:31:10Z",
          "confidence": "high",
          "useful": true,
          "correctness": "correct",
          "notes": "Merged PR #453 with green core CI and no review objection."
        }
      },
      "sourceRefs": [
        {
          "kind": "workflow-run",
          "url": "https://github.com/jlapenna/agent-lcars/actions/runs/30869989822",
          "sha256": null,
          "access": "public"
        },
        {
          "kind": "issue",
          "url": "https://github.com/jlapenna/agent-lcars/issues/447",
          "sha256": null,
          "access": "public"
        },
        {
          "kind": "pull-request",
          "url": "https://github.com/jlapenna/agent-lcars/pull/453",
          "sha256": null,
          "access": "public"
        }
      ],
      "protocol": {
        "takeover": "unknown",
        "progress": "unknown",
        "durableResult": "observed",
        "terminalBehavior": "observed",
        "adherent": true
      }
    },
    {
      "id": "run-30869944091",
      "repository": "jlapenna/agent-lcars",
      "repositoryVisibility": "public",
      "anchor": {
        "number": 446,
        "type": "issue",
        "snapshot": {
          "availability": "reference-only",
          "capturedAt": null,
          "sourceRef": {
            "kind": "issue",
            "url": "https://github.com/jlapenna/agent-lcars/issues/446",
            "sha256": null,
            "access": "public"
          }
        }
      },
      "taskClass": "console-ui",
      "dispatch": {
        "mode": "implement",
        "generation": 1,
        "workflowSha": "4fc73d489d1e7a04a19bcb976665f8bbc9b682a0",
        "workflowPath": ".github/workflows/claude.yml",
        "runId": 30869944091,
        "runUrl": "https://github.com/jlapenna/agent-lcars/actions/runs/30869944091",
        "workflowConclusion": "success",
        "agent": "claude",
        "provider": "anthropic",
        "model": null,
        "budgetMinutes": 90,
        "brief": {
          "availability": "reference-only",
          "capturedAt": null,
          "sourceRef": {
            "kind": "dispatch-brief",
            "url": "https://github.com/jlapenna/agent-lcars/actions/runs/30869944091",
            "sha256": null,
            "access": "public"
          }
        }
      },
      "setup": {
        "outcome": "ready",
        "agentProcessStarted": true,
        "modelTurnObserved": true
      },
      "milestones": {
        "queuedAt": "2026-08-04T01:49:54Z",
        "agentStartedAt": "2026-08-04T01:50:31Z",
        "takeoverAt": null,
        "diagnosisAt": null,
        "firstDurableArtifactAt": "2026-08-04T02:00:52Z",
        "terminalAt": "2026-08-04T02:01:48Z"
      },
      "trajectory": {
        "outcome": "productive",
        "archiveRefs": []
      },
      "terminal": {
        "kind": "merged-deliverable",
        "artifactRefs": [
          {
            "kind": "pull-request",
            "url": "https://github.com/jlapenna/agent-lcars/pull/455",
            "sha256": null,
            "access": "public"
          }
        ]
      },
      "quality": {
        "accepted": true,
        "ci": "green",
        "review": "no-objection",
        "merged": true,
        "regression": "none-known"
      },
      "efficiency": {
        "queueSeconds": 24,
        "modelSeconds": 664,
        "firstArtifactSeconds": 621,
        "runnerMinutes": 11.48,
        "retries": 0
      },
      "annotations": {
        "automatic": {
          "confidence": "high",
          "sourceRefs": [
            {
              "kind": "workflow-run",
              "url": "https://github.com/jlapenna/agent-lcars/actions/runs/30869944091",
              "sha256": null,
              "access": "public"
            }
          ]
        },
        "human": {
          "reviewer": "jlapenna",
          "reviewedAt": "2026-08-04T15:31:10Z",
          "confidence": "high",
          "useful": true,
          "correctness": "correct",
          "notes": "Merged PR #455 with green core CI and no review objection."
        }
      },
      "sourceRefs": [
        {
          "kind": "workflow-run",
          "url": "https://github.com/jlapenna/agent-lcars/actions/runs/30869944091",
          "sha256": null,
          "access": "public"
        },
        {
          "kind": "issue",
          "url": "https://github.com/jlapenna/agent-lcars/issues/446",
          "sha256": null,
          "access": "public"
        },
        {
          "kind": "pull-request",
          "url": "https://github.com/jlapenna/agent-lcars/pull/455",
          "sha256": null,
          "access": "public"
        }
      ],
      "protocol": {
        "takeover": "unknown",
        "progress": "unknown",
        "durableResult": "observed",
        "terminalBehavior": "observed",
        "adherent": true
      }
    },
    {
      "id": "run-30869929697",
      "repository": "jlapenna/agent-lcars",
      "repositoryVisibility": "public",
      "anchor": {
        "number": 445,
        "type": "issue",
        "snapshot": {
          "availability": "reference-only",
          "capturedAt": null,
          "sourceRef": {
            "kind": "issue",
            "url": "https://github.com/jlapenna/agent-lcars/issues/445",
            "sha256": null,
            "access": "public"
          }
        }
      },
      "taskClass": "console-ui",
      "dispatch": {
        "mode": "implement",
        "generation": 1,
        "workflowSha": "4fc73d489d1e7a04a19bcb976665f8bbc9b682a0",
        "workflowPath": ".github/workflows/claude.yml",
        "runId": 30869929697,
        "runUrl": "https://github.com/jlapenna/agent-lcars/actions/runs/30869929697",
        "workflowConclusion": "success",
        "agent": "claude",
        "provider": "anthropic",
        "model": null,
        "budgetMinutes": 90,
        "brief": {
          "availability": "reference-only",
          "capturedAt": null,
          "sourceRef": {
            "kind": "dispatch-brief",
            "url": "https://github.com/jlapenna/agent-lcars/actions/runs/30869929697",
            "sha256": null,
            "access": "public"
          }
        }
      },
      "setup": {
        "outcome": "ready",
        "agentProcessStarted": true,